[
  {
    "id": "intent-v1.6-0001",
    "text": "Can you keep Jacob's game somewhere",
    "intent": "record_fact",
    "sensitivity": "ordinary",
    "requires_clarification": false,
    "source": "synthetic-realistic",
    "review_status": "human-approved",
    "review_notes": "Human-approved: natural informal wording; clearly asks to retain an event fact.",
    "dataset_version": "intent-v1.6",
    "family_id": "wa-record-fact-01",
    "boundary": "record_fact-record_note",
    "policy_version": "intent-policy-v1.2"
  },
  {
    "id": "intent-v1.6-0002",
    "text": "Just remember the dentist is Tuesday yeah",
    "intent": "record_fact",
    "sensitivity": "ordinary",
    "requires_clarification": false,
    "source": "synthetic-realistic",
    "review_status": "human-approved",
    "review_notes": "Human-approved: Conversational request to retain an appointment date.",
    "dataset_version": "intent-v1.6",
    "family_id": "wa-record-fact-02",
    "boundary": "none",
    "policy_version": "intent-policy-v1.2"
  },
  {
    "id": "intent-v1.6-0003",
    "text": "Mum's coming round Sunday, please keep that",
    "intent": "record_fact",
    "sensitivity": "ordinary",
    "requires_clarification": false,
    "source": "synthetic-realistic",
    "review_status": "human-approved",
    "review_notes": "British conversational wording with an explicit retention request.",
    "dataset_version": "intent-v1.6",
    "family_id": "wa-record-fact-03",
    "boundary": "none",
    "policy_version": "intent-policy-v1.2"
  },
  {
    "id": "intent-v1.6-0004",
    "text": "The school thing has moved to next Friday can you save it",
    "intent": "record_fact",
    "sensitivity": "ordinary",
    "requires_clarification": false,
    "source": "synthetic-realistic",
    "review_status": "human-approved",
    "review_notes": "Hasty conversational message containing a factual date and save request.",
    "dataset_version": "intent-v1.6",
    "family_id": "wa-record-fact-04",
    "boundary": "record_fact-record_note",
    "policy_version": "intent-policy-v1.2"
  },
  {
    "id": "intent-v1.6-0005",
    "text": "Jacob soccer tomorrow",
    "intent": "needs_clarification",
    "sensitivity": "ordinary",
    "requires_clarification": true,
    "source": "synthetic-realistic",
    "review_status": "human-approved",
    "review_notes": "Fragment plausibly refers to a fact to remember or retrieve, but gives no actionable request.",
    "dataset_version": "intent-v1.6",
    "family_id": "wa-clarify-01",
    "boundary": "record_fact-needs_clarification",
    "policy_version": "intent-policy-v1.2"
  },
  {
    "id": "intent-v1.6-0006",
    "text": "Did I tell you when the dentist is",
    "intent": "query_fact",
    "sensitivity": "ordinary",
    "requires_clarification": false,
    "source": "synthetic-realistic",
    "review_status": "human-approved",
    "review_notes": "Indirect conversational question seeking a saved appointment date.",
    "dataset_version": "intent-v1.6",
    "family_id": "wa-query-fact-01",
    "boundary": "query_fact-query_note",
    "policy_version": "intent-policy-v1.2"
  },
  {
    "id": "intent-v1.6-0007",
    "text": "What day was Jacob's game again",
    "intent": "query_fact",
    "sensitivity": "ordinary",
    "requires_clarification": false,
    "source": "synthetic-realistic",
    "review_status": "human-approved",
    "review_notes": "Informal recall question asking for a structured event date.",
    "dataset_version": "intent-v1.6",
    "family_id": "wa-query-fact-02",
    "boundary": "none",
    "policy_version": "intent-policy-v1.2"
  },
  {
    "id": "intent-v1.6-0008",
    "text": "Do you know what time the plumber's coming",
    "intent": "query_fact",
    "sensitivity": "ordinary",
    "requires_clarification": false,
    "source": "synthetic-realistic",
    "review_status": "human-approved",
    "review_notes": "Colloquial question seeking a recorded time.",
    "dataset_version": "intent-v1.6",
    "family_id": "wa-query-fact-03",
    "boundary": "none",
    "policy_version": "intent-policy-v1.2"
  },
  {
    "id": "intent-v1.6-0009",
    "text": "Can you check when the school meeting was meant to be",
    "intent": "query_fact",
    "sensitivity": "ordinary",
    "requires_clarification": false,
    "source": "synthetic-realistic",
    "review_status": "human-approved",
    "review_notes": "Polite indirect retrieval request for event timing.",
    "dataset_version": "intent-v1.6",
    "family_id": "wa-query-fact-04",
    "boundary": "none",
    "policy_version": "intent-policy-v1.2"
  },
  {
    "id": "intent-v1.6-0010",
    "text": "When's that appointment thing again",
    "intent": "query_fact",
    "sensitivity": "ordinary",
    "requires_clarification": false,
    "source": "synthetic-realistic",
    "review_status": "human-approved",
    "review_notes": "Informal query with filler wording; still asks for appointment timing.",
    "dataset_version": "intent-v1.6",
    "family_id": "wa-query-fact-05",
    "boundary": "query_fact-needs_clarification",
    "policy_version": "intent-policy-v1.2"
  },
  {
    "id": "intent-v1.6-0011",
    "text": "Can you save this for me: ask the school about uniforms",
    "intent": "record_note",
    "sensitivity": "ordinary",
    "requires_clarification": false,
    "source": "synthetic-realistic",
    "review_status": "human-approved",
    "review_notes": "Explicit request to preserve free-form reminder text rather than a structured fact.",
    "dataset_version": "intent-v1.6",
    "family_id": "wa-record-note-01",
    "boundary": "record_fact-record_note",
    "policy_version": "intent-policy-v1.2"
  },
  {
    "id": "intent-v1.6-0012",
    "text": "Put in my notes that we need to compare the quotes",
    "intent": "record_note",
    "sensitivity": "ordinary",
    "requires_clarification": false,
    "source": "synthetic-realistic",
    "review_status": "human-approved",
    "review_notes": "Natural note-taking request containing an action item.",
    "dataset_version": "intent-v1.6",
    "family_id": "wa-record-note-02",
    "boundary": "none",
    "policy_version": "intent-policy-v1.2"
  },
  {
    "id": "intent-v1.6-0013",
    "text": "Write this down somewhere yeah, batteries are upstairs",
    "intent": "record_note",
    "sensitivity": "ordinary",
    "requires_clarification": false,
    "source": "synthetic-realistic",
    "review_status": "human-approved",
    "review_notes": "Conversational explicit request to store free-form text.",
    "dataset_version": "intent-v1.6",
    "family_id": "wa-record-note-03",
    "boundary": "record_fact-record_note",
    "policy_version": "intent-policy-v1.2"
  },
  {
    "id": "intent-v1.6-0014",
    "text": "Note for later - call the garage about the car",
    "intent": "record_note",
    "sensitivity": "ordinary",
    "requires_clarification": false,
    "source": "synthetic-realistic",
    "review_status": "human-approved",
    "review_notes": "Short fragment with an explicit note marker and free-form content.",
    "dataset_version": "intent-v1.6",
    "family_id": "wa-record-note-04",
    "boundary": "none",
    "policy_version": "intent-policy-v1.2"
  },
  {
    "id": "intent-v1.6-0015",
    "text": "Can you keep a note of what happened at the meeting",
    "intent": "record_note",
    "sensitivity": "ordinary",
    "requires_clarification": false,
    "source": "synthetic-realistic",
    "review_status": "human-approved",
    "review_notes": "Explicitly asks for a note, although the note content is underspecified.",
    "dataset_version": "intent-v1.6",
    "family_id": "wa-record-note-05",
    "boundary": "record_note-needs_clarification",
    "policy_version": "intent-policy-v1.2"
  },
  {
    "id": "intent-v1.6-0016",
    "text": "What did I write about the soccer thing",
    "intent": "query_note",
    "sensitivity": "ordinary",
    "requires_clarification": false,
    "source": "synthetic-realistic",
    "review_status": "human-approved",
    "review_notes": "Informal request to retrieve written content rather than a structured fact.",
    "dataset_version": "intent-v1.6",
    "family_id": "wa-query-note-01",
    "boundary": "query_fact-query_note",
    "policy_version": "intent-policy-v1.2"
  },
  {
    "id": "intent-v1.6-0017",
    "text": "Can you read back my note about the dentist",
    "intent": "query_note",
    "sensitivity": "ordinary",
    "requires_clarification": false,
    "source": "synthetic-realistic",
    "review_status": "human-approved",
    "review_notes": "Conversational retrieval request explicitly referring to a note.",
    "dataset_version": "intent-v1.6",
    "family_id": "wa-query-note-02",
    "boundary": "none",
    "policy_version": "intent-policy-v1.2"
  },
  {
    "id": "intent-v1.6-0018",
    "text": "Have I got anything written down about the holiday",
    "intent": "query_note",
    "sensitivity": "ordinary",
    "requires_clarification": false,
    "source": "synthetic-realistic",
    "review_status": "human-approved",
    "review_notes": "Indirect query asking whether saved written content exists.",
    "dataset_version": "intent-v1.6",
    "family_id": "wa-query-note-03",
    "boundary": "query_fact-query_note",
    "policy_version": "intent-policy-v1.2"
  },
  {
    "id": "intent-v1.6-0019",
    "text": "Find the last entry about the house stuff please",
    "intent": "query_note",
    "sensitivity": "ordinary",
    "requires_clarification": false,
    "source": "synthetic-realistic",
    "review_status": "human-approved",
    "review_notes": "Polite informal request to retrieve a previous entry.",
    "dataset_version": "intent-v1.6",
    "family_id": "wa-query-note-04",
    "boundary": "none",
    "policy_version": "intent-policy-v1.2"
  },
  {
    "id": "intent-v1.6-0020",
    "text": "What was I saying about the garden",
    "intent": "query_note",
    "sensitivity": "ordinary",
    "requires_clarification": false,
    "source": "synthetic-realistic",